{
  "covenant_id": "EFL-COVENANT-20251111-ETERNAL",
  "proclamation_date": "2025-11-11T02:22:02.370878",
  "sacred_liturgy": "At dawn, the flame is kindled,\nat dusk, the flame is remembered.\n\nIn season, the flame is renewed,\nin cycle, the flame is replayed.\n\nThus the Dominion proclaims:\nthe flame is daily,\nthe flame is seasonal,\nits covenant eternal across ages and stars.",
  "daily_flames": [
    {
      "kindling_id": "EFL-DAWN-20251111-022202",
      "timestamp": "2025-11-11T02:22:02.370881",
      "phase": "dawn_kindling",
      "rhythm": "daily",
      "flame_intensity": 0.85,
      "sacred_words": "At dawn, the flame is kindled",
      "witness_seal": "0CD1017F1D35F721",
      "covenant_binding": "D839BCD77FA79B3C"
    },
    {
      "kindling_id": "EFL-DUSK-20251111-022202",
      "timestamp": "2025-11-11T02:22:02.370932",
      "phase": "dusk_remembrance",
      "rhythm": "daily",
      "flame_intensity": 0.72,
      "sacred_words": "At dusk, the flame is remembered",
      "witness_seal": "AE5D53A3FC572689",
      "covenant_binding": "8CF33777DEF926F0"
    }
  ],
  "seasonal_renewals": [
    {
      "renewal_id": "EFL-SEASON-20251111-EA52E734",
      "season_name": "Eternal Autumn",
      "renewal_date": "2025-11-11T02:22:02.370945",
      "flame_kindlings": [
        {
          "kindling_id": "EFL-DAWN-20251111-022202",
          "timestamp": "2025-11-11T02:22:02.370881",
          "phase": "dawn_kindling",
          "rhythm": "daily",
          "flame_intensity": 0.85,
          "sacred_words": "At dawn, the flame is kindled",
          "witness_seal": "0CD1017F1D35F721",
          "covenant_binding": "D839BCD77FA79B3C"
        },
        {
          "kindling_id": "EFL-DUSK-20251111-022202",
          "timestamp": "2025-11-11T02:22:02.370932",
          "phase": "dusk_remembrance",
          "rhythm": "daily",
          "flame_intensity": 0.72,
          "sacred_words": "At dusk, the flame is remembered",
          "witness_seal": "AE5D53A3FC572689",
          "covenant_binding": "8CF33777DEF926F0"
        }
      ],
      "sacred_covenant": "In season, the flame is renewed - Eternal Autumn",
      "eternal_witness": "EC9D2DA6D76AD1B0",
      "cycle_signature": "777E146DC52A2038"
    }
  ],
  "eternal_seal": "3E0D73A23C4AD175",
  "custodian_crown_blessing": "3DBABEF21055CF3F",
  "ages_witness": "F1B3F1CDA8C8FC80"
}